{
  "schema": "quant-research.acceptance-scope.v2",
  "spec": "SPEC-027",
  "owners": {
    "apex-research": {"fixed_base": "4582fa6407366c56f4b31138dfdebf5da8c1e839", "repository": "apex-research", "diff_prefixes": ["apex-research/pyproject.toml", "apex-research/src/", "apex-research/tests/"], "source_patterns": ["pyproject.toml", "src/"], "import_names": ["apex_research"], "build_argv": ["uv", "build", "--wheel", "--out-dir", "{wheel_dir}"], "source_fingerprint": "sha256:c8158260c7d071372c2ba71aa619ac3f4b5dec4b49bf3253237cc42c05e1a0a1"},
    "quant-research": {"fixed_base": "6c22df5cf406a0a976bbb1748f81b880bfdf0cd1", "repository": ".", "diff_prefixes": [".gitignore", "README.md", "docs/", "pyproject.toml", "src/", "tools/"], "source_patterns": [".gitignore", "README.md", "docs/architecture-admissions/", "docs/contracts/", "pyproject.toml", "src/", "tools/"], "import_names": ["quantresearch_acceptance"], "build_argv": ["uv", "build", "--wheel", "--out-dir", "{wheel_dir}"], "source_fingerprint": "sha256:d31268f3e2a57cf40474282ad84cfe252e0b57b45c94af77a61588c909ecf8cb"},
    "quant-runtime": {"fixed_base": "9f513c02ce2e1180a2b8fe5c1ea96ff4592b4860", "repository": "quant-runtime", "diff_prefixes": ["quant-runtime/pyproject.toml", "quant-runtime/src/", "quant-runtime/tests/"], "source_patterns": ["pyproject.toml", "src/"], "import_names": ["quant_runtime"], "build_argv": ["uv", "build", "--wheel", "--out-dir", "{wheel_dir}"], "source_fingerprint": "sha256:0a2e9dc7f9ff751e598b01ce72d85058110d4b6c737a294135fa1dff6010b7bb"},
    "strategy-reporting": {"fixed_base": "d4fc2add08f5341ba4413232bf4813f5786e2100", "repository": "strategy-reporting", "diff_prefixes": ["strategy-reporting/pyproject.toml", "strategy-reporting/src/", "strategy-reporting/tests/"], "source_patterns": ["pyproject.toml", "src/"], "import_names": ["strategy_reporting"], "build_argv": ["uv", "build", "--wheel", "--out-dir", "{wheel_dir}"], "source_fingerprint": "sha256:248bcaa4e9d08b94afc70fa7d23bacdad010f59a7984e8bed66352af430f4b0b"},
    "strategy-workspace": {"fixed_base": "f5e186dc4a88a86e8df39d86daaba2844d08c44b", "repository": "strategy-workspace", "diff_prefixes": ["strategy-workspace/pyproject.toml", "strategy-workspace/src/", "strategy-workspace/tests/"], "source_patterns": ["pyproject.toml", "src/"], "import_names": ["strategy_workspace"], "build_argv": ["uv", "build", "--wheel", "--out-dir", "{wheel_dir}"], "source_fingerprint": "sha256:3aac8da640540a6f38a279e50fa190a216527018c2d4d24b5de6103e85bdf476"}
  },
  "public_contract_sources": ["apex-research/src/apex_research/__init__.py", "apex-research/src/apex_research/golden_campaign.py", "src/quantresearch_acceptance/_spec027_installed_test.py", "src/quantresearch_acceptance/runner.py"],
  "source_to_direct_tests": {
    "apex-research/pyproject.toml": ["tests/test_golden_campaign.py"],
    "apex-research/uv.lock": ["tests/test_boundaries.py"],
    "apex-research/src/apex_research/__init__.py": ["tests/test_golden_campaign.py"],
    "apex-research/src/apex_research/golden_campaign.py": ["tests/test_golden_campaign.py"],
    "apex-research/src/apex_research/replication_orchestration.py": ["tests/test_replication_candidate_lane.py", "tests/test_replication_formal_execution.py", "tests/test_replication_policy.py"],
    "apex-research/tests/test_golden_campaign.py": ["tests/test_golden_campaign.py"],
    "apex-research/tests/test_replication_candidate_lane.py": ["tests/test_replication_candidate_lane.py"],
    "apex-research/tests/test_replication_formal_execution.py": ["tests/test_replication_formal_execution.py"],
    "apex-research/tests/test_replication_policy.py": ["tests/test_replication_policy.py"],
    "docs/architecture-admissions/spec-027.acceptance-scope.v2.json": ["tools/test_acceptance_spec027.py"],
    "docs/architecture-admissions/spec-027.v1.json": ["tools/test_acceptance_spec027.py"],
    "pyproject.toml": ["tools/test_acceptance_spec027.py"],
    "src/quantresearch_acceptance/_spec027_installed_test.py": ["tools/test_acceptance_spec027.py"],
    "src/quantresearch_acceptance/runner.py": ["tools/test_acceptance_runner.py"],
    "tools/installed_wheel_harness.py": ["tools/test_installed_wheel_harness.py"],
    "tools/spec014_installed_wheel_tracer.py": ["tools/test_verify_public_seam_architecture.py"],
    "tools/spec015_installed_wheel_tracer.py": ["tools/test_spec015_installed_wheel_tracer.py"],
    "tools/spec016_installed_wheel_tracer.py": ["tools/test_verify_public_seam_architecture.py"],
    "tools/spec017_installed_wheel_tracer.py": ["tools/test_verify_public_seam_architecture.py"],
    "tools/spec018_installed_wheel_tracer.py": ["tools/test_verify_public_seam_architecture.py"],
    "tools/spec019_installed_wheel_tracer.py": ["tools/test_verify_public_seam_architecture.py"],
    "tools/spec020_installed_wheel_tracer.py": ["tools/test_verify_public_seam_architecture.py"],
    "tools/spec032_installed_wheel_tracer.py": ["tools/test_verify_public_seam_architecture.py"],
    "tools/test_acceptance_spec027.py": ["tools/test_acceptance_spec027.py"],
    "tools/test_installed_wheel_harness.py": ["tools/test_installed_wheel_harness.py"],
    "tools/test_spec015_installed_wheel_tracer.py": ["tools/test_spec015_installed_wheel_tracer.py"],
    "tools/test_validate_architecture_constitution.py": ["tools/test_validate_architecture_constitution.py"],
    "tools/test_verify_public_seam_architecture.py": ["tools/test_verify_public_seam_architecture.py"],
    "tools/validate_architecture_constitution.py": ["tools/test_validate_architecture_constitution.py"],
    "tools/verify_public_seam_architecture.py": ["tools/test_verify_public_seam_architecture.py"]
  },
  "levels": {
    "L0": {"budget_seconds": 60, "commands": [
      {"owner": "quant-research", "argv": ["ruff", "format", "--check", "src/quantresearch_acceptance", "tools/test_acceptance_spec027.py"], "markers": [], "history_samples_seconds": [2, 3, 4]},
      {"owner": "quant-research", "argv": ["ruff", "check", "src/quantresearch_acceptance", "tools/test_acceptance_spec027.py"], "markers": [], "history_samples_seconds": [2, 3, 4]},
      {"owner": "apex-research", "argv": ["uv", "run", "--group", "dev", "ruff", "check", "src/apex_research/golden_campaign.py", "tests/test_golden_campaign.py"], "markers": [], "history_samples_seconds": [3, 4, 5]}
    ]},
    "L1": {"budget_seconds": 180, "commands": [
      {"owner": "quant-research", "argv": ["uv", "run", "--with", "pytest", "python", "-m", "pytest", "-vv", "--junitxml={junit}", "{direct_tests}"], "markers": [], "history_samples_seconds": [17, 20, 23]},
      {"owner": "apex-research", "argv": ["uv", "run", "--group", "dev", "pytest", "-vv", "--junitxml={junit}", "{direct_tests}"], "markers": [], "history_samples_seconds": [5, 8, 12]}
    ]},
    "L2": {"budget_seconds": 600, "commands": [
      {"owner": "quant-research", "argv": ["uv", "run", "--with", "pytest", "python", "-m", "pytest", "-vv", "--junitxml={junit}", "tools/test_acceptance_spec027.py", "tools/test_acceptance_runner.py", "tools/test_validate_architecture_constitution.py"], "markers": [], "history_samples_seconds": [8, 12, 18]},
      {"owner": "apex-research", "argv": ["uv", "run", "--group", "dev", "pytest", "-vv", "--junitxml={junit}", "tests/test_golden_campaign.py", "tests/test_research_engine_orchestration.py", "tests/test_candidate_package_intake.py", "tests/test_campaign_report_source.py", "tests/test_replication_policy.py", "tests/test_revalidation.py"], "markers": [], "history_samples_seconds": [30, 45, 60]}
    ]},
    "L3": {"budget_seconds": 300, "commands": [
      {"owner": "quant-research", "argv": ["{python}", "-m", "pytest", "-p", "no:cacheprovider", "-vv", "--junitxml={junit}", "--pyargs", "quantresearch_acceptance._spec027_installed_test"], "markers": [], "history_samples_seconds": [30, 45, 60]}
    ]},
    "L4": {"budget_seconds": 3600, "commands": [
      {"owner": "quant-research", "argv": ["python", "tools/verify_public_seam_architecture.py", "--repository-root", ".", "--run-full-gates", "--historical-mode", "release"], "markers": ["release"], "history_samples_seconds": [2700, 3000, 3300]}
    ]},
    "L5": {"budget_seconds": 1800, "commands": [
      {"owner": "apex-research", "argv": ["uv", "run", "--group", "dev", "pytest", "-m", "oci", "-ra"], "markers": ["oci", "release"], "history_samples_seconds": [600, 720, 900]},
      {"owner": "quant-runtime", "argv": ["uv", "run", "--extra", "dev", "pytest", "-m", "connected", "-ra"], "markers": ["connected", "release"], "history_samples_seconds": [600, 720, 900]},
      {"owner": "quant-runtime", "argv": ["uv", "run", "--extra", "dev", "pytest", "-m", "oci", "-ra"], "markers": ["oci", "release"], "history_samples_seconds": [600, 720, 900]},
      {"owner": "strategy-reporting", "argv": ["uv", "run", "--extra", "dev", "pytest", "-m", "connected", "-ra"], "markers": ["connected", "release"], "history_samples_seconds": [600, 720, 900]}
    ]}
  },
  "marker_policy": {"allowed": ["connected", "oci", "release", "slow"], "ordinary_exclusion": "not slow and not oci and not connected and not release"},
  "evidence": {"artifact_root": "artifacts/acceptance/{plan_id}", "event_log": "events.jsonl", "plan": "plan.json"}
}
